Source,Title,Link,Summary,Published,SEO_Score,cleaned,topic_cluster,sentiment_score,lexicon_score,impact_score,impact_level,operational_tag,event_flag,cluster_name
EconomyNext,Disaster diplomacy aids Sri Lanka as World rallies after Ditwah’s trail of destruction,https://economynext.com/disaster-diplomacy-aids-sri-lanka-as-world-rallies-after-ditwahs-trail-of-destruction-252276/,Sri Lanka has witnessed one of the worst damage to its public infrastructure in the disaster,"Wed, 10 Dec 2025 03:00:19 +0000",6.65,disaster diplomacy aids sri lanka world rallies ditwah trail destruction sri lanka witnessed one worst damage public infrastructure disaster,4,-0.9648,-10.0,-10.0,High Risk,"weather, sentiment",Emerging Event,"Sri, Lanka, Cyclone"
EconomyNext,Direct Sri Lanka flights by Vietnam Airlines from Aug 2026,https://economynext.com/direct-sri-lanka-flights-by-vietnam-airlines-from-aug-2026-252323/,Hayleys group is the General Sales Agent.,"Wed, 10 Dec 2025 02:25:15 +0000",6.65,direct sri lanka flights vietnam airlines aug 2026 hayleys group general sales agent,0,0.0,0.0,0.0,Neutral,transport,Normal,"Sri, Lanka, Bank"
EconomyNext,Sri Lanka SEC warns public over Gladius South Asia,https://economynext.com/sri-lanka-sec-warns-public-over-gladius-south-asia-252309/,"UK authorities has said they also have not registered such a firm, SEC said","Wed, 10 Dec 2025 01:02:43 +0000",6.65,sri lanka sec warns public gladius south asia uk authorities said also registered firm sec said,3,-0.1027,0.0,-0.1027,Neutral,sentiment,Emerging Event,"Sri, Lanka, President"
EconomyNext,Sri Lanka borrows US$30mn from World Bank for renewable energy,https://economynext.com/sri-lanka-borrows-us30mn-from-world-bank-for-renewable-energy-252299/,Borrowings for grid strengthening,"Tue, 09 Dec 2025 23:58:15 +0000",6.65,sri lanka borrows us 30mn world bank renewable energy borrowings grid strengthening,0,0.6486,4.0,4.6486,High Opportunity,"energy, economic",Normal,"Sri, Lanka, Bank"
EconomyNext,"US lends C-130J super Hercules aircraft to Sri Lanka, bowsers for Ditwah relief",https://economynext.com/us-lends-c-130j-super-hercules-aircraft-to-sri-lanka-bowsers-for-ditwah-relief-252304/,The United States is here to take on some heavy lifting,"Tue, 09 Dec 2025 23:32:44 +0000",6.65,us lends c 130j super hercules aircraft sri lanka bowsers ditwah relief united states take heavy lifting,0,0.8689,2.0,2.8689,High Opportunity,general,Normal,"Sri, Lanka, Bank"
EconomyNext,"Sri Lanka’s average tourist arrivals down 21-pct in first week of Dec, recovery expected",https://economynext.com/sri-lankas-average-tourist-arrivals-down-21-pct-in-first-week-of-dec-recovery-expected-252230/,Ditwah-hit floods and landslides has affected tourism hotspots Kandy and Nuwara Eliya,"Tue, 09 Dec 2025 12:00:42 +0000",6.65,sri lanka average tourist arrivals 21 pct first week dec recovery expected ditwah hit floods landslides affected tourism hotspots kandy nuwara eliya,4,-0.1531,3.0,2.8468999999999998,High Opportunity,"weather, transport",Emerging Event,"Sri, Lanka, Cyclone"
EconomyNext,"Sri Lanka rupee steady, bond yields drop",https://economynext.com/sri-lanka-rupee-steady-bond-yields-drop-252257/,Bond yields dropped dealers said.,"Tue, 09 Dec 2025 11:32:50 +0000",6.65,sri lanka rupee steady bond yields drop bond yields dropped dealers said,0,-0.2732,0.0,-0.2732,Neutral,economic,Normal,"Sri, Lanka, Bank"
EconomyNext,UN allocates USD 4.5 mn for Sri Lanka’s relief efforts,https://economynext.com/un-allocates-usd-4-5-mn-for-sri-lankas-relief-efforts-252254/,Ditwah-hit devastation is one of Sri Lanka's worst natural disasters in terms of damages to public infrastructure,"Tue, 09 Dec 2025 11:13:18 +0000",6.65,un allocates usd 4 5 mn sri lanka relief efforts ditwah hit devastation one sri lanka worst natural disasters terms damages public infrastructure,4,-0.8316,-2.5,-3.3316,High Risk,"weather, transport, energy, sentiment",Emerging Event,"Sri, Lanka, Cyclone"
EconomyNext,"Sri Lanka stocks bounce back buoyed by construction, banks",https://economynext.com/sri-lanka-stocks-bounce-back-buoyed-by-construction-banks-252226/,ASPI was up over 2 percent,"Tue, 09 Dec 2025 10:32:12 +0000",6.65,sri lanka stocks bounce back buoyed construction banks aspi 2 percent,0,0.0,0.0,0.0,Neutral,economic,Normal,"Sri, Lanka, Bank"
EconomyNext,"Sri Lanka’s food security after Cyclone Ditwah: Risk, recovery, and resilience",https://economynext.com/sri-lankas-food-security-after-cyclone-ditwah-risk-recovery-and-resilience-252214/,"An Institute of Policy Studies article looks at urgency of restoring transport links, supporting farmers","Tue, 09 Dec 2025 08:06:59 +0000",6.65,sri lanka food security cyclone ditwah risk recovery resilience institute policy studies article looks urgency restoring transport links supporting farmers,4,0.6597,-1.5,-0.8403,Risk,"weather, transport, security, sentiment",Emerging Event,"Sri, Lanka, Cyclone"
EconomyNext,"1,200 landslides in Sri Lanka by Cyclone Ditwah, 20-pct of  land under water: UNDP",https://economynext.com/1200-landslides-in-sri-lanka-by-cyclone-ditwah-20-pct-of-land-under-water-undp-252195/,"The floodwaters reached nearly 720,000 buildings, about one in every twelve buildings in the country","Tue, 09 Dec 2025 06:03:19 +0000",6.65,1 200 landslides sri lanka cyclone ditwah 20 pct land water undp floodwaters reached nearly 720 000 buildings one every twelve buildings country,4,0.1027,-4.5,-4.3973,High Risk,weather,Emerging Event,"Sri, Lanka, Cyclone"
EconomyNext,Global shipping outlook deteriorating in 2026: Fitch Ratings,https://economynext.com/global-shipping-outlook-deteriorating-in-2026-fitch-ratings-252198/,"Deteriorating outlook for the global shipping sector, reflecting geopolitical and policy risks","Tue, 09 Dec 2025 05:48:30 +0000",6.65,global shipping outlook deteriorating 2026 fitch ratings deteriorating outlook global shipping sector reflecting geopolitical policy risks,3,-0.2732,0.0,-0.2732,Neutral,"transport, sentiment",Emerging Event,"Sri, Lanka, President"
News.lk,Rs. 20 Million Contribution from Sriyani Dress Point to ‘Rebuilding Sri Lanka’ Fund,https://news.lk/news/rs-20-million-contribution-from-sriyani-dress-point-to-rebuilding-sri-lanka-fund,"






Daily donations continue to be received for the Government’s ‘Rebuilding Sri Lanka’ Fund, established to provide relief to those affected by Cyclone Ditwah. Sriyani Dress Point has made a financial contribution of Rs. 20 million to the fund.","Wed, 10 Dec 2025 01:16:27 +0530",6.4,rs 20 million contribution sriyani dress point rebuilding sri lanka fund daily donations continue received government rebuilding sri lanka fund established provide relief affected cyclone ditwah sriyani dress point made financial contribution rs 20 million fund,4,0.3612,3.5,3.8612,High Opportunity,"weather, sentiment",Emerging Event,"Sri, Lanka, Cyclone"
News.lk,India Extends Multi-Front Support to Sri Lanka’s Cyclone Relief Efforts,https://news.lk/news/india-extends-multi-front-support-to-sri-lankas-cyclone-relief-efforts,"India has strengthened its humanitarian support to Sri Lanka in the aftermath of Cyclone Ditwah, providing critical air assets, emergency supplies, engineering equipment and medical aid to bolster national rescue and recovery operations.","Wed, 10 Dec 2025 00:40:50 +0530",6.4,india extends multi front support sri lanka cyclone relief efforts india strengthened humanitarian support sri lanka aftermath cyclone ditwah providing critical air assets emergency supplies engineering equipment medical aid bolster national rescue recovery operations,4,0.8979,-3.0,-2.1021,High Risk,"weather, transport, health, security",Emerging Event,"Sri, Lanka, Cyclone"
News.lk,We will extend every possible support to rebuild the lives of all those affected by the disaster,https://news.lk/news/we-will-extend-every-possible-support-to-rebuild-the-lives-of-all-those-affected-by-the-disaster,"The Government extends gratitude to the Tri-Forces, the Police, public officers, volunteer organisations, the public, and all foreign nations who have dedicated themselves to supporting the affected people. - Prime Minister Dr. Harini Amarasuriya","Fri, 05 Dec 2025 02:44:43 +0530",6.4,extend every possible support rebuild lives affected disaster government extends gratitude tri forces police public officers volunteer organisations public foreign nations dedicated supporting affected people prime minister dr harini amarasuriya,4,0.7783,-0.5,0.2783,Neutral,"weather, transport, security, sentiment",Emerging Event,"Sri, Lanka, Cyclone"
News.lk,Management Committee of the ‘Rebuilding Sri Lanka’ Fund Appointed with Representatives from the Public and Private Sectors,https://news.lk/news/management-committee-of-the-rebuilding-sri-lanka-fund-appointed-with-representatives-from-the-public-and-private-sectors,"Cabinet approval has been granted to establish the ‘Rebuilding Sri Lanka’ Fund, aimed at rebuilding the country following the severe devastation caused by Cyclone ‘Ditwah’, one of the worst natural disasters in Sri Lanka’s recent history. The Fund is to be established as a statutory fund under the Presidential Secretariat and its Management Committee will comprise representatives from both the public and private sectors.","Tue, 02 Dec 2025 01:20:05 +0530",6.4,management committee rebuilding sri lanka fund appointed representatives public private sectors cabinet approval granted establish rebuilding sri lanka fund aimed rebuilding country following severe devastation caused cyclone ditwah one worst natural disasters sri lanka recent history fund established statutory fund presidential secretariat management committee comprise representatives public private sectors,4,-0.7579,-3.0,-3.7579000000000002,High Risk,"weather, transport, energy, sentiment",Emerging Event,"Sri, Lanka, Cyclone"
News.lk,Be Vigilant About Infectious Diseases as Floodwaters Recede,https://news.lk/news/be-vigilant-about-infectious-diseases-as-floodwaters-recede,"Assistant Secretary of the National Disaster Relief Services Centre, Jayatissa Munasinghe","Mon, 01 Dec 2025 20:01:01 +0530",6.4,vigilant infectious diseases floodwaters recede assistant secretary national disaster relief services centre jayatissa munasinghe,4,-0.0772,1.5,1.4228,Opportunity,"weather, health",Emerging Event,"Sri, Lanka, Cyclone"
News.lk,"Cyclone Ditva Leaves Over 830,000 Affected; 159 Dead",https://news.lk/news/cyclone-ditva-leaves-over-830-000-affected-159-dead,"Cyclone Ditva has caused widespread damage across the country. According to the Disaster Management Center, 833,985 people from 234,503 families have been affected as of 6.00 am today (30). A total of 159 deaths have been reported, and 203 people are still missing.","Sun, 30 Nov 2025 16:09:02 +0530",6.4,cyclone ditva leaves 830 000 affected 159 dead cyclone ditva caused widespread damage across country according disaster management center 833 985 people 234 503 families affected 6 00 today 30 total 159 deaths reported 203 people still missing,4,-0.9432,-10.0,-10.0,High Risk,"weather, transport, sentiment",Emerging Event,"Sri, Lanka, Cyclone"
News.lk,Telephone  Numbers Issued for Reporting Disaster Situations,https://news.lk/news/telephone-numbers-issued-for-reporting-disaster-situations,Sri Lanka Police has released the telephone numbers of the operation rooms of 47 police stations across the island. The press release is given below.,"Sat, 29 Nov 2025 13:45:14 +0530",6.4,telephone numbers issued reporting disaster situations sri lanka police released telephone numbers operation rooms 47 police stations across island press release given,3,-0.6249,-4.5,-5.1249,High Risk,"weather, transport, energy, security, sentiment",Emerging Event,"Sri, Lanka, President"
News.lk,India Reaffirms Strong Support to Sri Lanka in Disaster Response – PM Modi,https://news.lk/news/india-reaffirms-strong-support-to-sri-lanka-in-disaster-response-pm-modi,"Indian Prime Minister Narendra Modi has assured Sri Lanka of India’s unwavering support during times of disaster, reaffirming the country’s commitment under the Neighbourhood First Policy and Ocean Vision.","Sat, 29 Nov 2025 03:33:01 +0530",6.4,india reaffirms strong support sri lanka disaster response pm modi indian prime minister narendra modi assured sri lanka india unwavering support times disaster reaffirming country commitment neighbourhood first policy ocean vision,4,0.6808,-5.0,-4.3192,High Risk,"weather, transport, sentiment",Emerging Event,"Sri, Lanka, Cyclone"
News.lk,"Develop a Structured, Scientific Rehabilitation Programme for Drug Addicts",https://news.lk/news/develop-a-structured-scientific-rehabilitation-programme-for-drug-addicts,"President instructs ‘A Nation United’ National Steering Council
President directs Ministry of Justice to formulate new laws aimed at the swift disposal of seized dangerous drugs.","Wed, 26 Nov 2025 23:39:49 +0530",6.4,develop structured scientific rehabilitation programme drug addicts president instructs nation united national steering council president directs ministry justice formulate new laws aimed swift disposal seized dangerous drugs,3,0.5994,2.0,2.5994,High Opportunity,"health, security, sentiment",Emerging Event,"Sri, Lanka, President"
News.lk,Weather Forecast,https://news.lk/news/weather-forecast-5,"







A low-pressure area has formed over South Andaman Sea area. It is likely to move west-northwestwards and intensify into a depression over South-east Bay of Bengal today (24).","Mon, 24 Nov 2025 13:41:04 +0530",6.4,weather forecast low pressure area formed south andaman sea area likely move west northwestwards intensify depression south east bay bengal today 24,2,-0.7906,0.0,-0.7906,Risk,weather,Normal,"Landslide, Heavy, Issued"
News.lk,Weather Forecast,https://news.lk/news/weather-forecast-4,"







Prevailing showery condition over the island is expected to continue further during the next few days.","Sun, 23 Nov 2025 13:14:12 +0530",6.4,weather forecast prevailing showery condition island expected continue next days,3,0.0,0.0,0.0,Neutral,weather,Emerging Event,"Sri, Lanka, President"
News.lk,SLIIT Law Faculty Students Visit President’s House,https://news.lk/news/sliit-law-faculty-students-visit-presidents-house,"The students of the Faculty of Law of the Sri Lanka Institute of Information Technology (SLIIT), Malabe, were given the opportunity to participate in the ‘Vision’ programme organised by the Presidential Secretariat, today (21).
This programme is implemented for students jointly by the Presidential Secretariat, the Ministry of Education and the Department of Communication of the Parliament.
In parallel with this programme, a valuable donation of saplings was made to the institute as a symbolic gesture highlighting the importance of environmental conservation.
Senior Additional Secretary to the President, Mr. Roshan Gamage, Lecturer of the Faculty of Law of the Sri Lanka Institute of Information Technology (SLIIT), Mr. Gimhan Sooriyabandara and Major Nadeeka Dangolla, Assistant Director of the Tri-Forces Coordination Unit at the Presidential Secretariat participated at the event.","Sat, 22 Nov 2025 00:50:29 +0530",6.4,sliit law faculty students visit president house students faculty law sri lanka institute information technology sliit malabe given opportunity participate vision programme organised presidential secretariat today 21 programme implemented students jointly presidential secretariat ministry education department communication parliament parallel programme valuable donation saplings made institute symbolic gesture highlighting importance environmental conservation senior additional secretary president mr roshan gamage lecturer faculty law sri lanka institute information technology sliit mr gimhan sooriyabandara major nadeeka dangolla assistant director tri forces coordination unit presidential secretariat participated event,3,0.8555,4.0,4.8555,High Opportunity,"transport, security, economic, sentiment",Emerging Event,"Sri, Lanka, President"
News.lk,Support the continued maintenance of the economic stability we have achieved – President tells the Government Medical Officers’ Association,https://news.lk/news/support-the-continued-maintenance-of-the-economic-stability-we-have-achieved-president-tells-the-government-medical-officers-association,"“Let us rebuild this country together, without creating a situation where you keep asking and I simply keep giving.” – President","Tue, 18 Nov 2025 00:04:10 +0530",6.4,support continued maintenance economic stability achieved president tells government medical officers association let us rebuild country together without creating situation keep asking simply keep giving president,3,0.4959,4.0,4.4959,High Opportunity,"transport, energy, health, security, sentiment",Emerging Event,"Sri, Lanka, President"
Onlanka.com,Former Central Bank Governor Ajith Nivard Cabraal acquitted in Greek Bond case,https://www.onlanka.com/news/former-central-bank-governor-ajith-nivard-cabraal-acquitted-in-greek-bond-case.html,"Former Central Bank Governor Ajith Nivard Cabraal and three others were acquitted today (December 10) in a case regarding the investment in Greek bonds in 2011.
The post Former Central Bank Governor Ajith Nivard Cabraal acquitted in Greek Bond case appeared first on Sri Lanka News | Breaking News &amp; Top Stories in Sri Lanka | ONLANKA.","Wed, 10 Dec 2025 08:32:43 +0000",6.45,former central bank governor ajith nivard cabraal acquitted greek bond case former central bank governor ajith nivard cabraal three others acquitted today december 10 case regarding investment greek bonds 2011 post former central bank governor ajith nivard cabraal acquitted greek bond case appeared first sri lanka news breaking news amp top stories sri lanka onlanka,0,0.7003,2.0,2.7003,High Opportunity,economic,Normal,"Sri, Lanka, Bank"
Onlanka.com,"Rebuilding Sri Lanka program receives LKR 1,893 Million for cyclone relief",https://www.onlanka.com/news/rebuilding-sri-lanka-program-receives-lkr-1893-million-for-cyclone-relief.html,"Secretary of the Ministry of Finance, Planning and Economic Development, Dr. Harshana Suriyapperuma, announced that the Rebuilding Sri Lanka program has received LKR 1,893 million in funding from both local and overseas Sri Lankans, as well as various institutions.
The post Rebuilding Sri Lanka program receives LKR 1,893 Million for cyclone relief appeared first on Sri Lanka News | Breaking News &amp; Top Stories in Sri Lanka | ONLANKA.","Wed, 10 Dec 2025 06:46:41 +0000",6.45,rebuilding sri lanka program receives lkr 1 893 million cyclone relief secretary ministry finance planning economic development dr harshana suriyapperuma announced rebuilding sri lanka program received lkr 1 893 million funding local overseas sri lankans well various institutions post rebuilding sri lanka program receives lkr 1 893 million cyclone relief appeared first sri lanka news breaking news amp top stories sri lanka onlanka,4,0.8442,5.0,5.8442,High Opportunity,"weather, economic, sentiment",Emerging Event,"Sri, Lanka, Cyclone"
Onlanka.com,Sri Lanka establishes high-level committee to coordinate foreign disaster relief,https://www.onlanka.com/news/sri-lanka-establishes-high-level-committee-to-coordinate-foreign-disaster-relief.html,"A High-Level Committee has been established to ensure the effective coordination, allocation, and distribution of foreign humanitarian relief assistance provided to Sri Lanka in the aftermath of the recent natural disaster.
The post Sri Lanka establishes high-level committee to coordinate foreign disaster relief appeared first on Sri Lanka News | Breaking News &amp; Top Stories in Sri Lanka | ONLANKA.","Wed, 10 Dec 2025 04:41:24 +0000",6.45,sri lanka establishes high level committee coordinate foreign disaster relief high level committee established ensure effective coordination allocation distribution foreign humanitarian relief assistance provided sri lanka aftermath recent natural disaster post sri lanka establishes high level committee coordinate foreign disaster relief appeared first sri lanka news breaking news amp top stories sri lanka onlanka,4,0.6124,-1.5,-0.8876,Risk,weather,Emerging Event,"Sri, Lanka, Cyclone"
Onlanka.com,Train services to Colombo Fort resume after culvert repairs,https://www.onlanka.com/news/train-services-to-colombo-fort-resume-after-culvert-repairs.html,"Sri Lanka Railways announced that train services will operate today from Rambukkana, Polgahawela, Kurunegala, Ganewatta, Nattandiya, and Kochchikade to Colombo Fort.
The post Train services to Colombo Fort resume after culvert repairs appeared first on Sri Lanka News | Breaking News &amp; Top Stories in Sri Lanka | ONLANKA.","Wed, 10 Dec 2025 04:16:59 +0000",6.45,train services colombo fort resume culvert repairs sri lanka railways announced train services operate today rambukkana polgahawela kurunegala ganewatta nattandiya kochchikade colombo fort post train services colombo fort resume culvert repairs appeared first sri lanka news breaking news amp top stories sri lanka onlanka,3,0.2023,0.0,0.2023,Neutral,"weather, transport",Emerging Event,"Sri, Lanka, President"
Onlanka.com,Sri Lanka secures US$ 30 Million World Bank loan for renewable energy project,https://www.onlanka.com/news/sri-lanka-secures-us-30-million-world-bank-loan-for-renewable-energy-project.html,"The Government of Sri Lanka has secured a loan of US$ 30 million from the International Development Association (IDA) of the World Bank Group to finance the implementation of the “Secure, Affordable and Sustainable Energy for Sri Lanka Project.”
The post Sri Lanka secures US$ 30 Million World Bank loan for renewable energy project appeared first on Sri Lanka News | Breaking News &amp; Top Stories in Sri Lanka | ONLANKA.","Wed, 10 Dec 2025 02:35:35 +0000",6.45,sri lanka secures us 30 million world bank loan renewable energy project government sri lanka secured loan us 30 million international development association ida world bank group finance implementation secure affordable sustainable energy sri lanka project post sri lanka secures us 30 million world bank loan renewable energy project appeared first sri lanka news breaking news amp top stories sri lanka onlanka,0,0.93,6.0,6.93,High Opportunity,"energy, economic, sentiment",Normal,"Sri, Lanka, Bank"
Onlanka.com,Sri Lanka Navy moves into new Headquarters on 75th anniversary,https://www.onlanka.com/news/sri-lanka-navy-moves-into-new-headquarters-on-75th-anniversary.html,"The Sri Lanka Navy officially moved into its new Headquarters at the Defence Headquarters Complex (DHQC) in Akuregoda today (December 9), marking a historic milestone as the Navy celebrated its 75th anniversary.
The post Sri Lanka Navy moves into new Headquarters on 75th anniversary appeared first on Sri Lanka News | Breaking News &amp; Top Stories in Sri Lanka | ONLANKA.","Tue, 09 Dec 2025 14:33:20 +0000",6.45,sri lanka navy moves new headquarters 75th anniversary sri lanka navy officially moved new headquarters defence headquarters complex dhqc akuregoda today december 9 marking historic milestone navy celebrated 75th anniversary post sri lanka navy moves new headquarters 75th anniversary appeared first sri lanka news breaking news amp top stories sri lanka onlanka,3,0.7096,2.0,2.7096,High Opportunity,security,Emerging Event,"Sri, Lanka, President"
Onlanka.com,"Sri Lanka to reopen most schools from December 16, 2025",https://www.onlanka.com/news/sri-lanka-to-reopen-most-schools-from-december-16-2025.html,"The Ministry of Education in Sri Lanka has confirmed that schools in the Western, Southern, Northern, Sabaragamuwa, Eastern, and North Central provinces will reopen on December 16, 2025.
The post Sri Lanka to reopen most schools from December 16, 2025 appeared first on Sri Lanka News | Breaking News &amp; Top Stories in Sri Lanka | ONLANKA.","Tue, 09 Dec 2025 11:00:05 +0000",6.45,sri lanka reopen schools december 16 2025 ministry education sri lanka confirmed schools western southern northern sabaragamuwa eastern north central provinces reopen december 16 2025 post sri lanka reopen schools december 16 2025 appeared first sri lanka news breaking news amp top stories sri lanka onlanka,3,0.2023,0.0,0.2023,Neutral,general,Emerging Event,"Sri, Lanka, President"
Onlanka.com,"Sri Lanka Navy promotes over 2,000 personnel during 75th anniversary celebrations",https://www.onlanka.com/news/sri-lanka-navy-promotes-over-2000-personnel-during-75th-anniversary-celebrations.html,"The Sri Lanka Navy marked its 75th anniversary today (December 09) with a series of special events, honoring long-standing naval traditions and religious observances.
The post Sri Lanka Navy promotes over 2,000 personnel during 75th anniversary celebrations appeared first on Sri Lanka News | Breaking News &amp; Top Stories in Sri Lanka | ONLANKA.","Tue, 09 Dec 2025 10:23:22 +0000",6.45,sri lanka navy promotes 2 000 personnel 75th anniversary celebrations sri lanka navy marked 75th anniversary today december 09 series special events honoring long standing naval traditions religious observances post sri lanka navy promotes 2 000 personnel 75th anniversary celebrations appeared first sri lanka news breaking news amp top stories sri lanka onlanka,3,0.891,0.0,0.891,Opportunity,security,Emerging Event,"Sri, Lanka, President"
