Source,Title,Link,Summary,Published,SEO_Score,cleaned,topic_cluster,sentiment_score,lexicon_score,impact_score,impact_level,operational_tag,event_flag,cluster_name
Dinamina,"ශිෂ්‍යත්වයේ නැවත සමීක්ෂණ ප්‍රතිඵල මත,  පාසල්වල 06 ශ්‍රේණියට සිසුන්ගේ අයදුම්පත්‍ර යොමු කිරීමේ කාලය දීර්ඝ කිරීමක්",https://www.dinamina.lk/2025/12/10/breaking-news/246550/%e0%b7%81%e0%b7%92%e0%b7%82%e0%b7%8a%e0%b6%ba%e0%b6%ad%e0%b7%8a%e0%b7%80%e0%b6%ba%e0%b7%9a-%e0%b6%b1%e0%b7%90%e0%b7%80%e0%b6%ad-%e0%b7%83%e0%b6%b8%e0%b7%93%e0%b6%9a%e0%b7%8a%e0%b7%82%e0%b6%ab-2/,"05 ශ්‍රේණි ශිෂ්‍යත්ව පරීක්ෂණයේ නැවත සමීක්ෂණ ප්‍රතිඵල මත, පාසල්වල 06 ශ්‍රේණියට සිසුන්ගේ අයදුම්පත්‍ර විදුහල්පතිවරුන් විසින් මාර්ගගත පද්ධතියට යොමු කිරීමේ කාලය දීර්ඝ කිරීමට&#8230;
The post ශිෂ්‍යත්වයේ නැවත සමීක්ෂණ ප්‍රතිඵල මත,  පාසල්වල 06 ශ්‍රේණියට සිසුන්ගේ අයදුම්පත්‍ර යොමු කිරීමේ කාලය දීර්ඝ කිරීමක් appeared first on දිනමිණ.","Wed, 10 Dec 2025 06:45:25 +0000",5.9,06 05 06 8230 post 06 appeared first,1,0.0,0.0,0.0,Neutral,general,Normal,"Post, Appeared, 8230"
Dinamina,2026 IPL ක්‍රීඩක වෙන්දේසිය 16වැනිදා,https://www.dinamina.lk/2025/12/10/sports/246544/2026-ipl-%e0%b6%9a%e0%b7%8a%e0%b6%bb%e0%b7%93%e0%b6%a9%e0%b6%9a-%e0%b7%80%e0%b7%99%e0%b6%b1%e0%b7%8a%e0%b6%af%e0%b7%9a%e0%b7%83%e0%b7%92%e0%b6%ba-16%e0%b7%80%e0%b7%90%e0%b6%b1%e0%b7%92/,"2026 IPL තරගාවලියේ ක්‍රීඩක වෙන්දේසිය දෙසැම්බර් මස 16 වැනිදා අබුඩාබිහිදී පැවැත්වීමට නියමිත බව BCCI නිවේදනය කර ඇත. මෙම ක්‍රීඩක වෙන්දේසියට ඉන්දීය මෙන්ම&#8230;
The post 2026 IPL ක්‍රීඩක වෙන්දේසිය 16වැනිදා appeared first on දිනමිණ.","Wed, 10 Dec 2025 06:31:02 +0000",5.9,2026 ipl 16 2026 ipl 16 bcci 8230 post 2026 ipl 16 appeared first,1,0.0,0.0,0.0,Neutral,general,Normal,"Post, Appeared, 8230"
Silumina,රැකී රක්ෂා,https://www.silumina.lk/2025/12/06/classifieds/53464/%e0%b6%bb%e0%b7%90%e0%b6%9a%e0%b7%93-%e0%b6%bb%e0%b6%9a%e0%b7%8a%e0%b7%82%e0%b7%8f-89/,"ඇබෑර්තු වෙළඳ / අලෙවිකරණ අපගේ රෙදි­පිලි ප්‍රදර්ශ­නා­ගා­ර­යට සේවක/​ සේවි­කා­වන් වහාම බඳවා ගනු ලැබේ. DAD එන්ටර්ප්‍රයිසස්,​ නො. 16,​ පමු­ණුව පාර,​ මහ­ර­ගම. 0777041524 079820 අලෙවි ක්ෂේත්‍රයේ නිද­හස් රැකි­යා­වක් විශ්‍රාමික බැංකු,​ ගුරු ගණ­කා­ධි­කාරී&#8230;
The post රැකී රක්ෂා appeared first on සිළුමිණ.","Fri, 05 Dec 2025 20:02:32 +0000",5.58,dad 16 0777041524 079820 8230 post appeared first,1,0.0,0.0,0.0,Neutral,general,Normal,"Post, Appeared, 8230"
Silumina,නාය නොයන බිම් අගලක් නැති ගම්පොළ විනාශය,https://www.silumina.lk/2025/12/06/news-features/53458/53458/,"කොත්මලේ ජලා­ශයේ බැම්ම පුපු­රා­ගොස් ඇති බවට ප්‍රවෘ­ත්ති­යක් සමාජ මාධ්‍ය ඔස්සේ සංස­ර­ණය විය. තවත් තැනක දැක්වුණේ බැම්ම බර­ප­තළ අන­තු­රක තිබෙන බවයි. මේ තොර­තුරු දැකී­මෙන් පසු එයින් දැඩි කම්ප­න­යට පත් කාන්තා­වක මිය­ගොස්&#8230;
The post නාය නොයන බිම් අගලක් නැති ගම්පොළ විනාශය appeared first on සිළුමිණ.","Fri, 05 Dec 2025 20:00:50 +0000",5.58,8230 post appeared first,1,0.0,0.0,0.0,Neutral,general,Normal,"Post, Appeared, 8230"
Silumina,සොබා­ද­හමේ අභි­යෝ­ග­යට මුහුණ දී සිටින ඉන්දු­නී­සි­යාව,https://www.silumina.lk/2025/12/06/world/53424/%e0%b7%83%e0%b7%9c%e0%b6%b6%e0%b7%8f%e0%b6%af%e0%b7%84%e0%b6%b8%e0%b7%9a-%e0%b6%85%e0%b6%b7%e0%b7%92%e0%b6%ba%e0%b7%9d%e0%b6%9c%e0%b6%ba%e0%b6%a7-%e0%b6%b8%e0%b7%94/,"සුළි­කු­ණාටු, භූක­ම්පන, සුනාමි, ජල ගැලීම් ආදි­යෙන් පීඩා විඳින ඉන්දු­නී­සි­යාවේ ජන­තා­වට මෙවර අධික වැසි­ව­ලින්ද බැට­කෑ­මට සිදු වූ අතර, 2004 වසරේ සුනා­මි­යෙන් අධික හානි­යට පත් සුමාත්‍රා දූපත ආසන්න ප්‍රදේ­ශ­ව­ලට මෙවර මහ වැසි­ව­ලින්&#8230;
The post සොබා­ද­හමේ අභි­යෝ­ග­යට මුහුණ දී සිටින ඉන්දු­නී­සි­යාව appeared first on සිළුමිණ.","Fri, 05 Dec 2025 20:00:41 +0000",5.58,2004 8230 post appeared first,1,0.0,0.0,0.0,Neutral,general,Normal,"Post, Appeared, 8230"
Silumina,ව්‍යාපාරික,https://www.silumina.lk/2025/12/06/classifieds/53465/%e0%b7%80%e0%b7%8a%e0%b6%ba%e0%b7%8f%e0%b6%b4%e0%b7%8f%e0%b6%bb%e0%b7%92%e0%b6%9a-114/,"වෙළෙඳ ව්‍යාපාරික අවස්ථාවන් අක්කර දෙකක ඉඩ­මක වගා කර ලැබෙන ලාභය බෙදා ගැනී­මට අයෙකු අවශ්‍යයි. 0112578090,​ 0112578520. 078437
The post ව්‍යාපාරික appeared first on සිළුමිණ.","Fri, 05 Dec 2025 20:00:33 +0000",5.58,0112578090 0112578520 078437 post appeared first,1,0.0,0.0,0.0,Neutral,general,Normal,"Post, Appeared, 8230"
Silumina,නිවාස හා ඉඩම්,https://www.silumina.lk/2025/12/06/classifieds/53463/%e0%b6%b1%e0%b7%92%e0%b7%80%e0%b7%8f%e0%b7%83-%e0%b7%84%e0%b7%8f-%e0%b6%89%e0%b6%a9%e0%b6%b8%e0%b7%8a-119/,"නිවාස හා ඉඩම් ගේ දොර ඉඩකඩම් කොළඹ දිස්ත්‍රික්කය විකිණීමට අැතු­ල්කෝට්ටේ ප්‍රියද­ර්ශන මාවත පර්චස් 12 බිම් කොට­සක් විකි­ණී­මට. නිර­වුල් ඔප්පු. පර්චස් 1ක් රු.මි. 3.8. 0711713700 074797 කොස්ගම නගර සමී­පයේ 603 බස්&#8230;
The post නිවාස හා ඉඩම් appeared first on සිළුමිණ.","Fri, 05 Dec 2025 20:00:30 +0000",5.58,12 1 3 8 0711713700 074797 603 8230 post appeared first,1,0.0,0.0,0.0,Neutral,general,Normal,"Post, Appeared, 8230"
Silumina,සාමාන්‍ය ‌සේවා,https://www.silumina.lk/2025/12/06/classifieds/53462/%e0%b7%83%e0%b7%8f%e0%b6%b8%e0%b7%8f%e0%b6%b1%e0%b7%8a%e0%b6%ba-%e0%b7%83%e0%b7%9a%e0%b7%80%e0%b7%8f-113/,"විවිධ අමතර ඉගැන්වීම් (ටියුෂන්) අ.උ.පෙ PHYSICS 070-3067766,​ COMBINED MATHS 077-5828008,​ CHEMISTRY 070-5070100 පළ­පු­රුදු උපා­ධි­ධාරී ගුරු­ව­රු­න්ගෙන් තනිව/​ කණ්ඩා­යම්. Live/​ onilne. 077996 BIOLOGY A/​L,​ උත්ත­ර­පත්‍ර පරීක්‍ෂකව­ර­යෙකි. පුන­රී­ක්ෂණ සිද්ධාන්ත ප්‍රවීණ ආචා­ර්ය­ව­ර­යෙක් නිව­සට. මහ­නු­වර,​&#8230;
The post සාමාන්‍ය ‌සේවා appeared first on සිළුමිණ.","Fri, 05 Dec 2025 20:00:29 +0000",5.58,physics 070 3067766 combined maths 077 5828008 chemistry 070 5070100 live onilne 077996 biology l 8230 post appeared first,1,0.0,0.0,0.0,Neutral,general,Normal,"Post, Appeared, 8230"
Silumina,රථවාහන,https://www.silumina.lk/2025/12/06/classifieds/53455/%e0%b6%bb%e0%b6%ae%e0%b7%80%e0%b7%8f%e0%b7%84%e0%b6%b1-67/,"රථවාහන බස් හා ලොරි රථ විකිණීම 42-1210 බෙන්ස් 1989 ටීක් අඩි 16.5&#8242; සම්පූර්ණ බොඩිය සහිත ලොරිය 2,​850,​000/​-. ස්කූටර් &#8211; BHS &#8211; 2016 &#8211; ට්‍රොපිකා 125 BGZ &#8211; 2018 &#8211; e-Now&#8230;
The post රථවාහන appeared first on සිළුමිණ.","Fri, 05 Dec 2025 20:00:16 +0000",5.58,42 1210 1989 16 5 8242 2 850 000 8211 bhs 8211 2016 8211 125 bgz 8211 2018 8211 e 8230 post appeared first,1,0.0,0.0,0.0,Neutral,general,Normal,"Post, Appeared, 8230"
Thinakaran,ரஷ்ய ஆயுதங்களது உதிரிப்பாகங்களை இந்தியாவில் தயாரிக்க இணக்கம்,https://www.thinakaran.lk/2025/12/10/world/168328/%e0%ae%b0%e0%ae%b7%e0%af%8d%e0%ae%af-%e0%ae%86%e0%ae%af%e0%af%81%e0%ae%a4%e0%ae%99%e0%af%8d%e0%ae%95%e0%ae%b3%e0%ae%a4%e0%af%81-%e0%ae%89%e0%ae%a4%e0%ae%bf%e0%ae%b0%e0%ae%bf%e0%ae%aa%e0%af%8d%e0%ae%aa/,"ரஷ்யாவில் உற்பத்தி செய்யப்படும் ஆயுதங்களுக்கும் பாதுகாப்பு உபகரணங்களுக்கும் உரிய உதிரிப் பாகங்கள் மற்றும் தொகுதிகளை இந்தியாவில் தயாரிப்பதற்கு இணக்கம் காணப்பட்டுள்ளன. ரஷ்ய ஜனாதிபதி விளாடிமிர் புட்டினுக்கும் இந்திய பிரதமர் நரேந்திர&#8230;
The post ரஷ்ய ஆயுதங்களது உதிரிப்பாகங்களை இந்தியாவில் தயாரிக்க இணக்கம் appeared first on Thinakaran.","Wed, 10 Dec 2025 10:19:16 +0000",5.5,8230 post appeared first thinakaran,1,0.0,0.0,0.0,Neutral,general,Normal,"Post, Appeared, 8230"
Thinakaran,புலமைப்பரிசில்: தரம் 6 இற்கு மாணவர் இணைக்கும் விண்ணப்பம் டிசம்பர் 12 வரை நீடிப்பு,https://www.thinakaran.lk/2025/12/10/breaking-news/168383/%e0%ae%aa%e0%af%81%e0%ae%b2%e0%ae%ae%e0%af%88%e0%ae%aa%e0%af%8d%e0%ae%aa%e0%ae%b0%e0%ae%bf%e0%ae%9a%e0%ae%bf%e0%ae%b2%e0%af%8d-%e0%ae%a4%e0%ae%b0%e0%ae%ae%e0%af%8d-6-%e0%ae%87%e0%ae%b1%e0%af%8d/,"புலமைப்பரிசில் மூலம் பாடசாலைகளுக்கு தரம் 6 இற்கு மாணவர்களை இணைக்கும் விண்ணப்ப முடிவுத் திகதி டிசம்பர் 12ஆம் திகதி வரை நீடிக்கப்பட்டுள்ளதாக, கல்வி அமைச்சு அறிவித்துள்ளது. இது தொடர்பில் அமைச்சின்&#8230;
The post புலமைப்பரிசில்: தரம் 6 இற்கு மாணவர் இணைக்கும் விண்ணப்பம் டிசம்பர் 12 வரை நீடிப்பு appeared first on Thinakaran.","Wed, 10 Dec 2025 07:16:56 +0000",5.5,6 12 6 12 8230 post 6 12 appeared first thinakaran,1,0.0,0.0,0.0,Neutral,general,Normal,"Post, Appeared, 8230"
Thinakaran,"இந்தோனேசிய கட்டடத்தில் பாரிய தீ, 20 பேர் உயிரிழப்பு",https://www.thinakaran.lk/2025/12/10/world/168326/%e0%ae%87%e0%ae%a8%e0%af%8d%e0%ae%a4%e0%af%8b%e0%ae%a9%e0%af%87%e0%ae%9a%e0%ae%bf%e0%ae%af-%e0%ae%95%e0%ae%9f%e0%af%8d%e0%ae%9f%e0%ae%9f%e0%ae%a4%e0%af%8d%e0%ae%a4%e0%ae%bf%e0%ae%b2%e0%af%8d-%e0%ae%aa/,"இந்தோனேசியாவின் தலைநகர் ஜகர்த்தாவிலுள்ள ஏழு மாடிகள் கொண்ட கட்டடமொன்றில் நேற்று ஏற்பட்ட தீ விபத்தில் சிக்கி 20 பேர் உயிரிழந்துள்ளதாக பொலிஸார் தெரிவித்தனர். மத்திய ஜகார்த்தாவில் உள்ள இக்கட்டடத்தின் முதல்&#8230;
The post இந்தோனேசிய கட்டடத்தில் பாரிய தீ, 20 பேர் உயிரிழப்பு appeared first on Thinakaran.","Wed, 10 Dec 2025 07:06:28 +0000",5.5,20 20 8230 post 20 appeared first thinakaran,1,0.0,0.0,0.0,Neutral,general,Normal,"Post, Appeared, 8230"
Thinakaran,நைஜீரியாவில் கடத்தப்பட்ட 100 மாணவர்கள் மீட்பு,https://www.thinakaran.lk/2025/12/10/world/168332/%e0%ae%a8%e0%af%88%e0%ae%9c%e0%af%80%e0%ae%b0%e0%ae%bf%e0%ae%af%e0%ae%be%e0%ae%b5%e0%ae%bf%e0%ae%b2%e0%af%8d-%e0%ae%95%e0%ae%9f%e0%ae%a4%e0%af%8d%e0%ae%a4%e0%ae%aa%e0%af%8d%e0%ae%aa%e0%ae%9f%e0%af%8d/,"நைஜீரியாவின் கத்தோலிக்க பாடசாலையொன்றில் இருந்து கடத்தப்பட்ட 100 சிறுவர்கள் மீட்கப்பட்டுள்ளதாக அதிகாரிகள் தெரிவித்துள்ளனர். நைஜீரியாவின் நைகர் மாநிலத்தின் பாபிரி என்ற இடத்திலுள்ள செயின்ட் மேரிஸ் கத்தோலிக்க பாடசாலையில் இருந்து கடத்தப்பட்ட&#8230;
The post நைஜீரியாவில் கடத்தப்பட்ட 100 மாணவர்கள் மீட்பு appeared first on Thinakaran.","Wed, 10 Dec 2025 06:17:53 +0000",5.5,100 100 8230 post 100 appeared first thinakaran,1,0.0,0.0,0.0,Neutral,general,Normal,"Post, Appeared, 8230"
Thinakaran,எதிர்க்கட்சித் தலைவர் அலுவலகத்தில் அனர்த்த தகவல் மையம்,https://www.thinakaran.lk/2025/12/10/breaking-news/168377/%e0%ae%8e%e0%ae%a4%e0%ae%bf%e0%ae%b0%e0%af%8d%e0%ae%95%e0%af%8d%e0%ae%95%e0%ae%9f%e0%af%8d%e0%ae%9a%e0%ae%bf%e0%ae%a4%e0%af%8d-%e0%ae%a4%e0%ae%b2%e0%af%88%e0%ae%b5%e0%ae%b0%e0%af%8d-%e0%ae%85-4/,"சீரற்ற வானிலையால் பாதிக்கப்பட்ட பிரதேசங்கள் மற்றும் அனர்த்தங்களால் பாதிக்கப்பட்டோர்கள் தொடர்பான தகவல்களைச் சேகரிக்கும் முகமாக கொழும்பு 07 இல் அமைந்துள்ள எதிர்க்கட்சி அலுவலகத்தில் அனர்த்த தகவல் மையமொன்று இன்று (10)&#8230;
The post எதிர்க்கட்சித் தலைவர் அலுவலகத்தில் அனர்த்த தகவல் மையம் appeared first on Thinakaran.","Wed, 10 Dec 2025 06:06:35 +0000",5.5,07 10 8230 post appeared first thinakaran,1,0.0,0.0,0.0,Neutral,general,Normal,"Post, Appeared, 8230"
Thinakaran,Re building Sri lanka திட்டத்திற்கு இதுவரை ரூ. 1893 மில்லியன் நிதி உதவி,https://www.thinakaran.lk/2025/12/10/breaking-news/168374/re-building-sri-lanka-%e0%ae%a4%e0%ae%bf%e0%ae%9f%e0%af%8d%e0%ae%9f%e0%ae%a4%e0%af%8d%e0%ae%a4%e0%ae%bf%e0%ae%b1%e0%af%8d%e0%ae%95%e0%af%81-%e0%ae%87%e0%ae%a4%e0%af%81%e0%ae%b5%e0%ae%b0%e0%af%88/,"டிட்வா சூறாவளியால் ஏற்பட்ட பேரழிவிலிருந்து நாட்டை மீண்டும் கட்டியெழுப்புவதற்காக ஆரம்பிக்கப்பட்டுள்ள Re building Sri lanka திட்டத்திற்கு, உள்நாட்டிலும் வெளிநாட்டிலும் இருந்து இலங்கையர்கள் மற்றும் பல்வேறு நிறுவனங்கள் ரூ. 1893&#8230;
The post Re building Sri lanka திட்டத்திற்கு இதுவரை ரூ. 1893 மில்லியன் நிதி உதவி appeared first on Thinakaran.","Wed, 10 Dec 2025 05:58:54 +0000",5.5,building sri lanka 1893 building sri lanka 1893 8230 post building sri lanka 1893 appeared first thinakaran,0,0.0,0.0,0.0,Neutral,general,Normal,"Sri, Lanka, Bank"
Thinakaran,இஸ்ரேல் 738 முறை போர் நிறுத்த மீறல்: 376 பலஸ்தீனர்கள் உயிரிழப்பு,https://www.thinakaran.lk/2025/12/10/world/168318/%e0%ae%87%e0%ae%b8%e0%af%8d%e0%ae%b0%e0%af%87%e0%ae%b2%e0%af%8d-738-%e0%ae%ae%e0%af%81%e0%ae%b1%e0%af%88-%e0%ae%aa%e0%af%8b%e0%ae%b0%e0%af%8d-%e0%ae%a8%e0%ae%bf%e0%ae%b1%e0%af%81%e0%ae%a4%e0%af%8d/,"காசாவில் போர் நிறுத்தத்திற்கு இன்றுடன் (10) இரண்டு மாதங்களை எட்டும் நிலையில் இதுவரை இஸ்ரேல் 738 தடவைகள் போர் நிறுத்த மீறலில் ஈடுபட்டிருப்பதாக காசா அரச ஊடக அலுவலகம் தெரிவித்துள்ளது.&#8230;
The post இஸ்ரேல் 738 முறை போர் நிறுத்த மீறல்: 376 பலஸ்தீனர்கள் உயிரிழப்பு appeared first on Thinakaran.","Wed, 10 Dec 2025 04:51:13 +0000",5.5,738 376 10 738 8230 post 738 376 appeared first thinakaran,1,0.0,0.0,0.0,Neutral,general,Normal,"Post, Appeared, 8230"
Thinakaran,மியன்மாரில் தேனீர் கடை மீது வான்வழித் தாக்குதல்: 18 பேர் பலி,https://www.thinakaran.lk/2025/12/10/world/168330/%e0%ae%ae%e0%ae%bf%e0%ae%af%e0%ae%be%e0%ae%a9%e0%af%8d%e0%ae%ae%e0%ae%b0%e0%ae%bf%e0%ae%b2%e0%af%8d-%e0%ae%a4%e0%af%87%e0%ae%a9%e0%af%80%e0%ae%b0%e0%af%8d%e0%ae%95%e0%ae%9f%e0%af%88-%e0%ae%ae%e0%af%80/,"&#8211; இராணுவம் &#8211; ஜனநாயக ஆதரவு படைகளுக்கு இடையில் உக்கிர மோதல் மியன்மாரின் சகாயிங் மாகாணத்திலுள்ள தேனீர்கடையொன்றின் மீது இராணுவம் நடத்திய வான்வழித் தாக்குதலில் 18 பேர் கொல்லப்பட்டுள்ளதோடு 20&#8230;
The post மியன்மாரில் தேனீர் கடை மீது வான்வழித் தாக்குதல்: 18 பேர் பலி appeared first on Thinakaran.","Wed, 10 Dec 2025 03:10:06 +0000",5.5,18 8211 8211 18 20 8230 post 18 appeared first thinakaran,1,0.0,0.0,0.0,Neutral,general,Normal,"Post, Appeared, 8230"
