Source,Title,Link,Summary,Published,SEO_Score,cleaned,topic_cluster,sentiment_score,lexicon_score,impact_score,impact_level,operational_tag,event_flag,cluster_name
Ada Derana,Deepavali inscribed on UNESCO s Intangible Cultural Heritage list,http://www.adaderana.lk/news.php?nid=115836,"India s Deepavali — the festival of lights — was on Wednesday (December 10, 2025) inscribed on the UNESCO s Representative List of the Intangible Cultural Heritage of Humanity, sparking celebrations to mark the earning of the coveted tag. MORE..","Wed, 10 Dec 2025 15:39:39 +0530",5.17,deepavali inscribed unesco intangible cultural heritage list india deepavali festival lights wednesday december 10 2025 inscribed unesco representative list intangible cultural heritage humanity sparking celebrations mark earning coveted tag,3,0.4939,2.0,2.4939,High Opportunity,general,Emerging Event,"Sri, Lanka, President"
Ada Derana,UAE continues to send aid to assist flood-hit Sri Lanka,http://www.adaderana.lk/news.php?nid=115835,The UAE s eight humanitarian aid aircraft has arrived in Sri Lanka on Tuesday in efforts to support the country following deadly floods and landslides. MORE..,"Wed, 10 Dec 2025 14:58:34 +0530",5.17,uae continues send aid assist flood hit sri lanka uae eight humanitarian aid aircraft arrived sri lanka tuesday efforts support country following deadly floods landslides,4,0.4019,7.5,7.9019,High Opportunity,"weather, transport",Emerging Event,"Sri, Lanka, Cyclone"
Ada Derana,Advisory issued for severe lightning,http://www.adaderana.lk/news.php?nid=115834,An Amber  advisory has been issued by the Department of Meteorology for severe lightning in the Western and Sabaragamuwa provinces and in Galle and Matara Districts. MORE..,"Wed, 10 Dec 2025 14:04:42 +0530",5.17,advisory issued severe lightning amber advisory issued department meteorology severe lightning western sabaragamuwa provinces galle matara districts,2,-0.6369,-6.0,-6.6369,High Risk,sentiment,Normal,"Landslide, Heavy, Issued"
Ada Derana,"Significant flooding reported after heavy rainfall in Jeddah, Saudi Arabia",http://www.adaderana.lk/news.php?nid=115833,"Jeddah, Saudi Arabia has experienced heavy rainfall that has led to significant flooding and traffic congestion across the city. MORE..","Wed, 10 Dec 2025 13:23:20 +0530",5.17,significant flooding reported heavy rainfall jeddah saudi arabia jeddah saudi arabia experienced heavy rainfall led significant flooding traffic congestion across city,2,0.3818,-1.5,-1.1182,Risk,"weather, transport",Normal,"Landslide, Heavy, Issued"
Ada Derana,Ex-Central Bank Governor Ajith Nivard Cabraal and three others acquitted in Greek Bond case,http://www.adaderana.lk/news.php?nid=115832,Former Central Bank Governor Ajith Nivard Cabraal has been released from the case pertaining to the 2012 purchase of Greek Bonds. MORE..,"Wed, 10 Dec 2025 13:01:23 +0530",5.17,ex central bank governor ajith nivard cabraal three others acquitted greek bond case former central bank governor ajith nivard cabraal released case pertaining 2012 purchase greek bonds,0,0.25,0.0,0.25,Neutral,economic,Normal,"Sri, Lanka, Bank"
Ada Derana,Case against Yoshitha and grandmother adjourned pending Daisy Forrest s medical report,http://www.adaderana.lk/news.php?nid=115831,"The Attorney General informed the Colombo High Court today (10) that Daisy Forrest, the grandmother of Yoshitha Rajapaksa and a defendant in a case filed under the Prevention of Money Laundering Act, is scheduled to undergo a psychiatric medical report tomorrow by the Colombo Judicial Medical Officer. MORE..","Wed, 10 Dec 2025 12:56:03 +0530",5.17,case yoshitha grandmother adjourned pending daisy forrest medical report attorney general informed colombo high court today 10 daisy forrest grandmother yoshitha rajapaksa defendant case filed prevention money laundering act scheduled undergo psychiatric medical report tomorrow colombo judicial medical officer,3,0.0,0.0,0.0,Neutral,"transport, health, security",Emerging Event,"Sri, Lanka, President"
Ada Derana,Homeowners in landslide-prone areas provided with reports on risk level- NBRO,http://www.adaderana.lk/news.php?nid=115830,The National Building Research Organisation (NBRO) has extended landslide warnings issued to several areas based on current ground conditions and weather forecasts. MORE..,"Wed, 10 Dec 2025 12:30:52 +0530",5.17,homeowners landslide prone areas provided reports risk level nbro national building research organisation nbro extended landslide warnings issued several areas based current ground conditions weather forecasts,2,-0.5106,-9.0,-9.5106,High Risk,"weather, transport, sentiment",Normal,"Landslide, Heavy, Issued"
Ada Derana,Heavy vehicles barred from using road over Kotmale Dam- Mahaweli Authority,http://www.adaderana.lk/news.php?nid=115829,"Heavy vehicles have been barred from using the road over the Kotmale Dam, the Mahaweli Development Authority (MDA) has announced. MORE..","Wed, 10 Dec 2025 12:00:25 +0530",5.17,heavy vehicles barred using road kotmale dam mahaweli authority heavy vehicles barred using road kotmale dam mahaweli development authority mda announced,2,0.1531,2.0,2.1531000000000002,High Opportunity,"weather, transport, sentiment",Normal,"Landslide, Heavy, Issued"
Ada Derana,Kolonna Pradeshiya Sabha s budget defeated for the second time,http://www.adaderana.lk/news.php?nid=115828,"The annual budget of the Kolonna Pradeshiya Sabha, which is controlled by the National People s Power (NPP), has been defeated for the second time. MORE..","Wed, 10 Dec 2025 11:28:10 +0530",5.17,kolonna pradeshiya sabha budget defeated second time annual budget kolonna pradeshiya sabha controlled national people power npp defeated second time,0,-0.7351,0.0,-0.7351,Risk,"energy, economic, sentiment",Normal,"Sri, Lanka, Bank"
Ada Derana,Family dog assists in locating bodies of seven victims in Ambokka landslide,http://www.adaderana.lk/news.php?nid=115827,"Highlands surrounding the Ambokka village within the Pallepola Divisional Secretariat area in Matale, have reportedly become increasingly unstable following recent heavy rains. MORE..","Wed, 10 Dec 2025 11:26:49 +0530",5.17,family dog assists locating bodies seven victims ambokka landslide highlands surrounding ambokka village within pallepola divisional secretariat area matale reportedly become increasingly unstable following recent heavy rains,2,-0.5859,-4.5,-5.0859,High Risk,"weather, transport",Normal,"Landslide, Heavy, Issued"
Ada Derana,H-1B visa appointments postponed for many Indians amid US  Social Media rules,http://www.adaderana.lk/news.php?nid=115826,The US State Department s new social media vetting policy has triggered massive disruptions for H-1B visa applicants in India as many appointments have been postponed to next year. The US Embassy in India issued an advisory to the visa applicants on Tuesday night. MORE..,"Wed, 10 Dec 2025 10:53:47 +0530",5.17,h 1b visa appointments postponed many indians amid us social media rules us state department new social media vetting policy triggered massive disruptions h 1b visa applicants india many appointments postponed next year us embassy india issued advisory visa applicants tuesday night,3,-0.6124,0.0,-0.6124,Risk,sentiment,Emerging Event,"Sri, Lanka, President"
Ada Derana,Google Maps begins updating Sri Lanka s road network – Minister,http://www.adaderana.lk/news.php?nid=115825,"Google Maps has commenced updating information pertaining Sri Lanka s road network covering around 12,000 kilometers, Minister of Transport Bimal Ratnayake has stated. MORE..","Wed, 10 Dec 2025 10:29:45 +0530",5.17,google maps begins updating sri lanka road network minister google maps commenced updating information pertaining sri lanka road network covering around 12 000 kilometers minister transport bimal ratnayake stated,3,0.0,0.0,0.0,Neutral,"transport, sentiment",Emerging Event,"Sri, Lanka, President"
Ada Derana,"“Rebuilding Sri Lanka” Fund receives Rs. 1,893 million thus far",http://www.adaderana.lk/news.php?nid=115824,"The “Rebuilding Sri Lanka” programme, initiated to restore the country following the damage caused by Cyclone “Ditwah,” has received a total of Rs. 1,893 million in funding from domestic sources, overseas Sri Lankans, and various institutions, the Secretary to the Ministry of Finance, Dr. Harshana Suriyapperuma has stated. MORE..","Wed, 10 Dec 2025 10:11:48 +0530",5.17,rebuilding sri lanka fund receives rs 1 893 million thus far rebuilding sri lanka programme initiated restore country following damage caused cyclone ditwah received total rs 1 893 million funding domestic sources overseas sri lankans various institutions secretary ministry finance dr harshana suriyapperuma stated,4,-0.25,1.5,1.25,Opportunity,"weather, economic",Emerging Event,"Sri, Lanka, Cyclone"
Ada Derana,"Over 50,000 tourists arrive in first eight days of December",http://www.adaderana.lk/news.php?nid=115823,"A total of 50,222 tourists have arrived in the country thus far in December, data from the Sri Lanka Tourism Development Authority (SLTDA) shows. MORE..","Wed, 10 Dec 2025 09:39:21 +0530",5.17,50 000 tourists arrive first eight days december total 50 222 tourists arrived country thus far december data sri lanka tourism development authority sltda shows,3,0.0772,2.0,2.0772,High Opportunity,sentiment,Emerging Event,"Sri, Lanka, President"
Ada Derana,"Landslide in Bogahapathana, no injuries or casualties reported",http://www.adaderana.lk/news.php?nid=115821,"A landslide has been reported in Bogahapathana, Meegahakiula. MORE..","Wed, 10 Dec 2025 08:57:47 +0530",5.17,landslide bogahapathana injuries casualties reported landslide reported bogahapathana meegahakiula,2,0.0,-9.0,-9.0,High Risk,"weather, transport",Normal,"Landslide, Heavy, Issued"
Ada Derana,"Britain sanctions Russian, Chinese entities over disinfo, cyber threats",http://www.adaderana.lk/news.php?nid=115820,Britain on Tuesday (Dec 9) sanctioned entities it accused of distorting information in favour of Russia as well as two Chinese companies for alleged cyber activities against the United Kingdom and its allies. MORE..,"Wed, 10 Dec 2025 08:47:43 +0530",5.17,britain sanctions russian chinese entities disinfo cyber threats britain tuesday dec 9 sanctioned entities accused distorting information favour russia well two chinese companies alleged cyber activities united kingdom allies,3,0.1779,0.0,0.1779,Neutral,general,Emerging Event,"Sri, Lanka, President"
Ada Derana,Youth succumbs following sudden explosion at fireworks factory in Katana,http://www.adaderana.lk/news.php?nid=115818,"A youth has died following a sudden explosion at a fireworks manufacturing factory in Kimbulapitiya, Katana, police stated. MORE..","Wed, 10 Dec 2025 08:11:47 +0530",5.17,youth succumbs following sudden explosion fireworks factory katana youth died following sudden explosion fireworks manufacturing factory kimbulapitiya katana police stated,5,-0.5574,-10.0,-10.0,High Risk,security,Normal,"China, Following, Police"
Ada Derana,Individual arrested over theft of telecom transmission cables in Rambukkana,http://www.adaderana.lk/news.php?nid=115817,"An individual has been arrested in connection with the theft of cables installed on a telecommunication transmission tower located in Yatagama, Rambukkana, police stated. MORE..","Wed, 10 Dec 2025 07:55:06 +0530",5.17,individual arrested theft telecom transmission cables rambukkana individual arrested connection theft cables installed telecommunication transmission tower located yatagama rambukkana police stated,3,-0.7351,-6.0,-6.7351,High Risk,security,Emerging Event,"Sri, Lanka, President"
Ada Derana,Train delays reported along the Main Line,http://www.adaderana.lk/news.php?nid=115816,"Trains operating along the main line are currently experiencing delays, Sri Lanka Railways has stated. MORE..","Wed, 10 Dec 2025 07:17:56 +0530",5.17,train delays reported along main line trains operating along main line currently experiencing delays sri lanka railways stated,0,0.0,-2.0,-2.0,High Risk,"weather, transport",Normal,"Sri, Lanka, Bank"
Ada Derana,Zelenskiy says he is open to elections if US ensures security,http://www.adaderana.lk/news.php?nid=115815,Ukrainian President Volodymyr Zelenskiy said on Tuesday he was prepared to hold elections within three months if the U.S. and Kyiv s other allies could ensure the security of the vote. MORE..,"Wed, 10 Dec 2025 06:55:01 +0530",5.17,zelenskiy says open elections us ensures security ukrainian president volodymyr zelenskiy said tuesday prepared hold elections within three months u kyiv allies could ensure security vote,3,0.8074,0.0,0.8074,Opportunity,"weather, security, sentiment",Emerging Event,"Sri, Lanka, President"
Daily News,"Today’s Exchange Rates – December 10, 2025",https://dailynews.lk/2025/12/10/business/911993/todays-exchange-rates-december-10-2025/,"The Central Bank of Sri Lanka has released the latest data on key financial ratios and economic indicators as of December 10, 2025. This information provides insights into the country’s&#8230;
The post Today’s Exchange Rates – December 10, 2025 appeared first on DailyNews.","Wed, 10 Dec 2025 10:15:32 +0000",5.8,today exchange rates december 10 2025 central bank sri lanka released latest data key financial ratios economic indicators december 10 2025 information provides insights country 8230 post today exchange rates december 10 2025 appeared first dailynews,0,0.0,0.0,0.0,Neutral,economic,Normal,"Sri, Lanka, Bank"
Daily News,Flood warnings withdrawn for 21 river basins as water levels stabilize,https://dailynews.lk/2025/12/10/local/911983/flood-warnings-withdrawn-for-21-river-basins-as-water-levels-stabilize/,"The Department of Irrigation has officially withdrawn flood warnings for 21 river basins across Sri Lanka, stating that water levels have returned to normal. The withdrawal applies to flood alerts&#8230;
The post Flood warnings withdrawn for 21 river basins as water levels stabilize appeared first on DailyNews.","Wed, 10 Dec 2025 09:55:42 +0000",5.8,flood warnings withdrawn 21 river basins water levels stabilize department irrigation officially withdrawn flood warnings 21 river basins across sri lanka stating water levels returned normal withdrawal applies flood alerts 8230 post flood warnings withdrawn 21 river basins water levels stabilize appeared first dailynews,3,-0.6705,-10.0,-10.0,High Risk,weather,Emerging Event,"Sri, Lanka, President"
Daily News,"Taliban detains 4 men for dressing up as “Peaky Blinders” characters, gives them rehabilitation",https://dailynews.lk/2025/12/10/breaking-news/911976/taliban-detains-4-men-for-dressing-up-as-peaky-blinders-characters-gives-them-rehabilitation/,"Four young men were detained by Afghanistan’s Taliban authorities and put into a rehabilitation program for walking around in public dressed up as their favorite characters from the hit British&#8230;
The post Taliban detains 4 men for dressing up as “Peaky Blinders” characters, gives them rehabilitation appeared first on DailyNews.","Wed, 10 Dec 2025 09:47:24 +0000",5.8,taliban detains 4 men dressing peaky blinders characters gives rehabilitation four young men detained afghanistan taliban authorities put rehabilitation program walking around public dressed favorite characters hit british 8230 post taliban detains 4 men dressing peaky blinders characters gives rehabilitation appeared first dailynews,3,0.0772,6.0,6.0772,High Opportunity,sentiment,Emerging Event,"Sri, Lanka, President"
Daily News,"Sri Lanka receives USD 300,000 donation from ADPC for disaster recovery",https://dailynews.lk/2025/12/10/local/911968/sri-lanka-receives-usd-300000-donation-from-adpc-for-disaster-recovery/,"Foreign Affairs Minister Vijitha Herath announced that Sri Lanka has received a donation of USD 300,000 from Mr. Aslam Perwaiz, Executive Director of the Asian Disaster Preparedness Center (ADPC). The&#8230;
The post Sri Lanka receives USD 300,000 donation from ADPC for disaster recovery appeared first on DailyNews.","Wed, 10 Dec 2025 09:34:02 +0000",5.8,sri lanka receives usd 300 000 donation adpc disaster recovery foreign affairs minister vijitha herath announced sri lanka received donation usd 300 000 mr aslam perwaiz executive director asian disaster preparedness center adpc 8230 post sri lanka receives usd 300 000 donation adpc disaster recovery appeared first dailynews,4,-0.9231,-1.5,-2.4231,High Risk,"weather, sentiment",Emerging Event,"Sri, Lanka, Cyclone"
Daily News,Twelve killed in residential fire in southern China,https://dailynews.lk/2025/12/10/breaking-news/911961/twelve-killed-in-residential-fire-in-southern-china/,"Twelve people have been killed in a residential fire in the southern Chinese city of Shantou, state news agency Xinhua reported on Wednesday. The blaze broke out on Tuesday at&#8230;
The post Twelve killed in residential fire in southern China appeared first on DailyNews.","Wed, 10 Dec 2025 09:19:33 +0000",5.8,twelve killed residential fire southern china twelve people killed residential fire southern chinese city shantou state news agency xinhua reported wednesday blaze broke tuesday 8230 post twelve killed residential fire southern china appeared first dailynews,5,-0.9735,-10.0,-10.0,High Risk,"transport, sentiment",Normal,"China, Following, Police"
Daily News,Man fined for damaging corals at Hikkaduwa; court orders restoration,https://dailynews.lk/2025/12/10/local/911946/man-fined-for-damaging-corals-at-hikkaduwa-court-orders-restoration/,"Wildlife officers at the Hikkaduwa National Park arrested a man on December 7 for damaging corals during a routine patrol. According to park officials, the suspect had broken corals and&#8230;
The post Man fined for damaging corals at Hikkaduwa; court orders restoration appeared first on DailyNews.","Wed, 10 Dec 2025 09:05:35 +0000",5.8,man fined damaging corals hikkaduwa court orders restoration wildlife officers hikkaduwa national park arrested man december 7 damaging corals routine patrol according park officials suspect broken corals 8230 post man fined damaging corals hikkaduwa court orders restoration appeared first dailynews,3,-0.9538,7.0,6.0462,High Opportunity,"weather, security",Emerging Event,"Sri, Lanka, President"
Daily News,Qatar Charity launches emergency relief project for Sri Lanka flood victims,https://dailynews.lk/2025/12/10/local/911939/qatar-charity-launches-emergency-relief-project-for-sri-lanka-flood-victims/,"Qatar Charity with the Qatar Fund for Development’s generous funding and in collaboration with the Embassy of the State of Qatar to Sri Lanka, has launched an emergency relief initiative&#8230;
The post Qatar Charity launches emergency relief project for Sri Lanka flood victims appeared first on DailyNews.","Wed, 10 Dec 2025 08:56:37 +0000",5.8,qatar charity launches emergency relief project sri lanka flood victims qatar charity qatar fund development generous funding collaboration embassy state qatar sri lanka launched emergency relief initiative 8230 post qatar charity launches emergency relief project sri lanka flood victims appeared first dailynews,4,0.8779,4.0,4.8779,High Opportunity,"weather, health, economic, sentiment",Emerging Event,"Sri, Lanka, Cyclone"
Daily News,"Kandy at breaking point: No clearance yet, Minister sounds alarm",https://dailynews.lk/2025/12/10/local/911932/kandy-at-breaking-point-no-clearance-yet-minister-sounds-alarm/,"Minister K.D. Lal Kantha expressed deep concern over the persistent red-level landslide warnings issued by the National Building Research Organisation (NBRO), cautioning that the situation in Kandy has become so&#8230;
The post Kandy at breaking point: No clearance yet, Minister sounds alarm appeared first on DailyNews.","Wed, 10 Dec 2025 08:25:30 +0000",5.8,kandy breaking point clearance yet minister sounds alarm minister k lal kantha expressed deep concern persistent red level landslide warnings issued national building research organisation nbro cautioning situation kandy become 8230 post kandy breaking point clearance yet minister sounds alarm appeared first dailynews,3,-0.7184,-6.0,-6.7184,High Risk,"weather, sentiment",Emerging Event,"Sri, Lanka, President"
Daily News,No more unauthorized constructions in Colombo – PM,https://dailynews.lk/2025/12/10/local/911925/no-more-unauthorized-constructions-in-colombo-pm/,"Prime Minister Dr. Harini Amarasuriya stated that there will be no permission granted for unauthorized constructions within the Colombo District, nor any form of residential developments that endanger the public&#8230;
The post No more unauthorized constructions in Colombo &#8211; PM appeared first on DailyNews.","Wed, 10 Dec 2025 07:45:53 +0000",5.8,unauthorized constructions colombo pm prime minister dr harini amarasuriya stated permission granted unauthorized constructions within colombo district form residential developments endanger public 8230 post unauthorized constructions colombo 8211 pm appeared first dailynews,3,0.25,5.0,5.25,High Opportunity,sentiment,Emerging Event,"Sri, Lanka, President"
Daily News,Notice from Education Ministry on Grade 6 admissions based on re-scrutinized Grade 5 Scholarship results,https://dailynews.lk/2025/12/10/local/911919/notice-from-education-ministry-on-grade-6-admissions-based-on-re-scrutinized-grade-5-scholarship-results/,"The Ministry of Education has extended the deadline for admission to Grade 6 in 2026 based on the re-scrutinized results of the 2025 Grade 5 Scholarship Examination, in view of&#8230;
The post Notice from Education Ministry on Grade 6 admissions based on re-scrutinized Grade 5 Scholarship results appeared first on DailyNews.","Wed, 10 Dec 2025 07:36:53 +0000",5.8,notice education ministry grade 6 admissions based scrutinized grade 5 scholarship results ministry education extended deadline admission grade 6 2026 based scrutinized results 2025 grade 5 scholarship examination view 8230 post notice education ministry grade 6 admissions based scrutinized grade 5 scholarship results appeared first dailynews,3,0.0,6.0,6.0,High Opportunity,general,Emerging Event,"Sri, Lanka, President"
EconomyNext,"Sri Lanka egg output down 30-pct after Ditwah kills 500,000 layers : industry",https://economynext.com/sri-lanka-egg-output-down-30-pct-after-ditwah-kills-500000-layers-industry-252380/,Prices almost double,"Wed, 10 Dec 2025 09:47:32 +0000",6.65,sri lanka egg output 30 pct ditwah kills 500 000 layers industry prices almost double,0,-0.5423,0.0,-0.5423,Risk,economic,Normal,"Sri, Lanka, Bank"
EconomyNext,"Sri Lanka stocks close up, pushed by Colombo Dockyard",https://economynext.com/sri-lanka-stocks-close-up-pushed-by-colombo-dockyard-252384/,"This positive momentum spread to other sectors, most notably into construction and banks","Wed, 10 Dec 2025 09:25:02 +0000",6.65,sri lanka stocks close pushed colombo dockyard positive momentum spread sectors notably construction banks,0,0.5574,0.0,0.5574,Opportunity,economic,Normal,"Sri, Lanka, Bank"
EconomyNext,Japan’s ‘shock treatment’ for Sri Lanka’s Flood Victims,https://economynext.com/japans-shock-treatment-for-sri-lankas-flood-victims-252362/,Japanese doc stuns Sri Lanka patients by bowing to them,"Wed, 10 Dec 2025 08:31:42 +0000",6.65,japan shock treatment sri lanka flood victims japanese doc stuns sri lanka patients bowing,3,-0.5859,-4.5,-5.0859,High Risk,"weather, health",Emerging Event,"Sri, Lanka, President"
EconomyNext,UK announces £1mn support for cyclone-hit Sri Lanka communities,https://economynext.com/uk-announces-1mn-support-for-cyclone-hit-sri-lanka-communities-252364/,The funding will be delivered through humanitarian partners.,"Wed, 10 Dec 2025 07:12:49 +0000",6.65,uk announces 1mn support cyclone hit sri lanka communities funding delivered humanitarian partners,4,0.4019,-0.5,-0.09810000000000002,Neutral,"weather, transport, economic",Emerging Event,"Sri, Lanka, Cyclone"
EconomyNext,Sri Lanka regulator meets insurers over Diwah claims,https://economynext.com/sri-lanka-regulator-meets-insurers-over-diwah-claims-252358/,"""Compensation payments for minor property damage have already commenced.""","Wed, 10 Dec 2025 06:12:17 +0000",6.65,sri lanka regulator meets insurers diwah claims compensation payments minor property damage already commenced,4,-0.4939,-3.0,-3.4939,High Risk,weather,Emerging Event,"Sri, Lanka, Cyclone"
EconomyNext,"Cyclone Ditwah kills 35,000 cattle in Sri Lanka, 2,000 pigs",https://economynext.com/cyclone-ditwah-kills-35000-cattle-in-sri-lanka-2000-pigs-252356/,"500,000 layer chicks and 1.4 million broilers also killed","Wed, 10 Dec 2025 05:53:53 +0000",6.65,cyclone ditwah kills 35 000 cattle sri lanka 2 000 pigs 500 000 layer chicks 1 4 million broilers also killed,4,-0.8402,-4.5,-5.3402,High Risk,"weather, energy",Emerging Event,"Sri, Lanka, Cyclone"
EconomyNext,Sri Lanka’s Abans Finance senior debt given ‘A-(EXP)(lka)’ rating by Fitch,https://economynext.com/sri-lankas-abans-finance-senior-debt-given-a-explka-rating-by-fitch-252352/,The proposed senior unsecured debentures will mature in five years and will be listed on the Colombo Stock Exchange.,"Wed, 10 Dec 2025 05:35:05 +0000",6.65,sri lanka abans finance senior debt given exp lka rating fitch proposed senior unsecured debentures mature five years listed colombo stock exchange,0,-0.3182,0.0,-0.3182,Risk,economic,Normal,"Sri, Lanka, Bank"
EconomyNext,"Sri Lanka rupee slightly weaker, bond yields steady",https://economynext.com/sri-lanka-rupee-slightly-weaker-bond-yields-steady-252343/,"An auction of Rs 48,000 million Treasury bills was ongoing.","Wed, 10 Dec 2025 04:13:22 +0000",6.65,sri lanka rupee slightly weaker bond yields steady auction rs 48 000 million treasury bills ongoing,0,-0.204,0.0,-0.204,Neutral,"energy, economic",Normal,"Sri, Lanka, Bank"
