Source,Title,Link,Summary,Published,SEO_Score,cleaned,topic_cluster,sentiment_score,lexicon_score,impact_score,impact_level,operational_tag,event_flag,cluster_name
Onlanka.com,UN releases $4.5 Million for Sri Lanka disaster relief,https://www.onlanka.com/news/un-releases-4-5-million-for-sri-lanka-disaster-relief.html,"The United Nations has pledged its full support to help Sri Lanka rebuild after severe damage caused by recent extreme weather.
The post UN releases $4.5 Million for Sri Lanka disaster relief appeared first on Sri Lanka News | Breaking News &amp; Top Stories in Sri Lanka | ONLANKA.","Tue, 09 Dec 2025 05:30:24 +0000",6.45,un releases 4 5 million sri lanka disaster relief united nations pledged full support help sri lanka rebuild severe damage caused recent extreme weather post un releases 4 5 million sri lanka disaster relief appeared first sri lanka news breaking news amp top stories sri lanka onlanka,4,0.0516,-5.0,-4.9484,High Risk,"weather, transport",Emerging Event,"Sri, Lanka, Cyclone"
Onlanka.com,"Sri Lanka reports 635 dead, 192 missing after extreme weather",https://www.onlanka.com/news/sri-lanka-reports-635-dead-192-missing-after-extreme-weather.html,"The Disaster Management Centre (DMC) reports that 635 deaths caused by adverse weather conditions in Sri Lanka have been recorded so far, while 192 people remain missing.
The post Sri Lanka reports 635 dead, 192 missing after extreme weather appeared first on Sri Lanka News | Breaking News &amp; Top Stories in Sri Lanka | ONLANKA.","Tue, 09 Dec 2025 04:14:24 +0000",6.45,sri lanka reports 635 dead 192 missing extreme weather disaster management centre dmc reports 635 deaths caused adverse weather conditions sri lanka recorded far 192 people remain missing post sri lanka reports 635 dead 192 missing extreme weather appeared first sri lanka news breaking news amp top stories sri lanka onlanka,4,-0.9638,-10.0,-10.0,High Risk,"weather, transport, sentiment",Emerging Event,"Sri, Lanka, Cyclone"
Onlanka.com,President orders swift restoration in Badulla,https://www.onlanka.com/news/president-orders-swift-restoration-in-badulla.html,"Sri Lankan President Anura Kumara Dissanayake stressed that the aim of the government is to ensure a safe life for every citizen and that it is everyone’s responsibility to act with proper supervision during the resettlement of displaced people.
The post President orders swift restoration in Badulla appeared first on Sri Lanka News | Breaking News &amp; Top Stories in Sri Lanka | ONLANKA.","Tue, 09 Dec 2025 02:30:50 +0000",6.45,president orders swift restoration badulla sri lankan president anura kumara dissanayake stressed aim government ensure safe life every citizen everyone responsibility act proper supervision resettlement displaced people post president orders swift restoration badulla appeared first sri lanka news breaking news amp top stories sri lanka onlanka,3,0.7579,1.5,2.2579000000000002,High Opportunity,sentiment,Emerging Event,"Sri, Lanka, President"
Onlanka.com,BNMF donates Rs. 250 Million for Cyclone Ditwah disaster relief,https://www.onlanka.com/news/bnmf-donates-rs-250-million-for-cyclone-ditwah-disaster-relief.html,"The Bandaranaike National Memorial Foundation (BNMF) has donated Rs. 250 million to support Sri Lanka’s recovery efforts after the natural disasters caused by Cyclone Ditwah.
The post BNMF donates Rs. 250 Million for Cyclone Ditwah disaster relief appeared first on Sri Lanka News | Breaking News &amp; Top Stories in Sri Lanka | ONLANKA.","Mon, 08 Dec 2025 17:18:19 +0000",6.45,bnmf donates rs 250 million cyclone ditwah disaster relief bandaranaike national memorial foundation bnmf donated rs 250 million support sri lanka recovery efforts natural disasters caused cyclone ditwah post bnmf donates rs 250 million cyclone ditwah disaster relief appeared first sri lanka news breaking news amp top stories sri lanka onlanka,4,-0.1531,-9.5,-9.6531,High Risk,"weather, transport",Emerging Event,"Sri, Lanka, Cyclone"
Onlanka.com,Foreign-made revolver and micro pistol recovered in Valaichchenai raid,https://www.onlanka.com/news/foreign-made-revolver-and-micro-pistol-recovered-in-valaichchenai-raid.html,"A special team from the Walana Anti-Vice Unit of the Sri Lanka Police carried out a raid this morning (December 8) in the area near the 20th milestone on the Polonnaruwa–Batticaloa main road, within the Valaichchenai Police Division.
The post Foreign-made revolver and micro pistol recovered in Valaichchenai raid appeared first on Sri Lanka News | Breaking News &amp; Top Stories in Sri Lanka | ONLANKA.","Mon, 08 Dec 2025 14:00:18 +0000",6.45,foreign made revolver micro pistol recovered valaichchenai raid special team walana anti vice unit sri lanka police carried raid morning december 8 area near 20th milestone polonnaruwa batticaloa main road within valaichchenai police division post foreign made revolver micro pistol recovered valaichchenai raid appeared first sri lanka news breaking news amp top stories sri lanka onlanka,3,0.296,2.0,2.296,High Opportunity,"transport, security",Emerging Event,"Sri, Lanka, President"
Onlanka.com,Sri Lanka receives major humanitarian aid from China following Cyclone Ditwah,https://www.onlanka.com/news/sri-lanka-receives-major-humanitarian-aid-from-china-following-cyclone-ditwah.html,"Sri Lanka received a large shipment of humanitarian aid from China today (December 08) to help communities affected by Cyclone Ditwah.
The post Sri Lanka receives major humanitarian aid from China following Cyclone Ditwah appeared first on Sri Lanka News | Breaking News &amp; Top Stories in Sri Lanka | ONLANKA.","Mon, 08 Dec 2025 13:25:52 +0000",6.45,sri lanka receives major humanitarian aid china following cyclone ditwah sri lanka received large shipment humanitarian aid china today december 08 help communities affected cyclone ditwah post sri lanka receives major humanitarian aid china following cyclone ditwah appeared first sri lanka news breaking news amp top stories sri lanka onlanka,4,0.4404,-0.5,-0.059599999999999986,Neutral,weather,Emerging Event,"Sri, Lanka, Cyclone"
Onlanka.com,Sri Lanka President orders urgent repairs on Nuwara Eliya roads and irrigation,https://www.onlanka.com/news/sri-lanka-president-holds-urgent-meeting-on-damaged-roads-in-nuwara-eliya.html,"A special discussion on the damage caused by recent adverse weather in the Nuwara Eliya District was held this morning (December 8) at the Nuwara Eliya District Secretariat under the patronage of Sri Lanka President Anura Kumara Dissanayake, along with relevant officials.
The post Sri Lanka President orders urgent repairs on Nuwara Eliya roads and irrigation appeared first on Sri Lanka News | Breaking News &amp; Top Stories in Sri Lanka | ONLANKA.","Mon, 08 Dec 2025 08:45:39 +0000",6.45,sri lanka president orders urgent repairs nuwara eliya roads irrigation special discussion damage caused recent adverse weather nuwara eliya district held morning december 8 nuwara eliya district secretariat patronage sri lanka president anura kumara dissanayake along relevant officials post sri lanka president orders urgent repairs nuwara eliya roads irrigation appeared first sri lanka news breaking news amp top stories sri lanka onlanka,3,0.1027,-6.0,-5.8973,High Risk,"weather, transport, sentiment",Emerging Event,"Sri, Lanka, President"
Onlanka.com,Government warns public against relief donation fraud,https://www.onlanka.com/news/government-warns-public-against-relief-donation-fraud.html,"The Government of Sri Lanka requests the general public to use the established formal mechanisms for the distribution of essential items through the Disaster Management Centre, District Disaster Committees, and Divisional Disaster Committees, and not to be misled by fraudsters.
The post Government warns public against relief donation fraud appeared first on Sri Lanka News | Breaking News &amp; Top Stories in Sri Lanka | ONLANKA.","Mon, 08 Dec 2025 08:34:39 +0000",6.45,government warns public relief donation fraud government sri lanka requests general public use established formal mechanisms distribution essential items disaster management centre district disaster committees divisional disaster committees misled fraudsters post government warns public relief donation fraud appeared first sri lanka news breaking news amp top stories sri lanka onlanka,4,-0.959,-10.0,-10.0,High Risk,"weather, sentiment",Emerging Event,"Sri, Lanka, Cyclone"
LankaBusinessOnline,Opinion: Will the Response to Ditwah be Worse than the Disaster?,https://www.lankabusinessonline.com/opinion-will-the-response-to-ditwah-be-worse-than-the-disaster/,"By M. Rizwan Muzzammil The Parable of the Broken Window In 1850, the French economist Frederic Bastiat penned “The Parable of the Broken Window.” A boy breaks a shop window, and a glazier is paid six francs to repair it. Onlookers muse that such accidents are good for trade, as they keep windowmakers in business. [&#8230;]","Mon, 08 Dec 2025 10:33:35 +0000",6.92,opinion response ditwah worse disaster rizwan muzzammil parable broken window 1850 french economist frederic bastiat penned parable broken window boy breaks shop window glazier paid six francs repair onlookers muse accidents good trade keep windowmakers business 8230,3,-0.9153,-2.5,-3.4153000000000002,High Risk,"weather, transport, security, economic",Emerging Event,"Sri, Lanka, President"
LankaBusinessOnline,"Economic, fiscal & credit impact of disaster likely most material for Sri Lanka: Moody’s Ratings",https://www.lankabusinessonline.com/economic-fiscal-credit-impact-of-disaster-likely-most-material-for-sri-lanka-moodys-ratings/,"According to Moody’s Ratings, South and Southeast Asian countries have been severely impacted by several tropical cyclones and unusually heavy monsoon rains since mid-November, leading to widespread flooding and landslides and the tragic loss of hundreds of lives. Moody's assesses that the economic, fiscal, and credit impact of this disaster is likely to be most [&#8230;]","Mon, 08 Dec 2025 09:42:49 +0000",6.92,economic fiscal credit impact disaster likely material sri lanka moody ratings according moody ratings south southeast asian countries severely impacted several tropical cyclones unusually heavy monsoon rains since mid november leading widespread flooding landslides tragic loss hundreds lives moody assesses economic fiscal credit impact disaster likely 8230,4,-0.9571,-10.0,-10.0,High Risk,"weather, economic",Emerging Event,"Sri, Lanka, Cyclone"
LankaBusinessOnline,EDB Launches Fast-Track Relief to Support Exporters Affected by Adverse Weather,https://www.lankabusinessonline.com/edb-launches-fast-track-relief-to-support-exporters-affected-by-adverse-weather/,"&#160;The Export Development Board (EDB) has launched a rapid relief and recovery program following the severe impact of adverse weather conditions on Sri Lanka's export sector. A discussion meeting was held recently at the EDB premises, with the participation of Secretary to the Ministry of Industry and Entrepreneurship Development Mrs. Tilaka Jayasundara, EDB Chairman and [&#8230;]","Mon, 08 Dec 2025 08:27:34 +0000",6.92,edb launches fast track relief support exporters affected adverse weather 160 export development board edb launched rapid relief recovery program following severe impact adverse weather conditions sri lanka export sector discussion meeting held recently edb premises participation secretary ministry industry entrepreneurship development mrs tilaka jayasundara edb chairman 8230,4,0.296,10.0,10.0,High Opportunity,"weather, transport, economic, sentiment",Emerging Event,"Sri, Lanka, Cyclone"
LankaBusinessOnline,Hambantota International Port Remains Fully Operational Despite Extreme Weather,https://www.lankabusinessonline.com/hambantota-international-port-remains-fully-operational-despite-extreme-weather/,"As Sri Lanka experiences one of the worst flood situations recorded in its history, which has crippled national infrastructure and forced operations to suspend at the Port of Colombo, Hambantota International Port (HIP) has remained fully operational, reinforcing its strategic importance as the country’s second major commercial hub. Although Hambantota also faced heavy rains, it [&#8230;]","Sun, 07 Dec 2025 07:23:10 +0000",6.92,hambantota international port remains fully operational despite extreme weather sri lanka experiences one worst flood situations recorded history crippled national infrastructure forced operations suspend port colombo hambantota international port hip remained fully operational reinforcing strategic importance country second major commercial hub although hambantota also faced heavy rains 8230,4,-0.7845,-4.5,-5.2844999999999995,High Risk,"weather, transport, security, economic, sentiment",Emerging Event,"Sri, Lanka, Cyclone"
LankaBusinessOnline,Relief Measures to Assist Businesses affected by Recent Disasters by Banks,https://www.lankabusinessonline.com/relief-measures-to-assist-businesses-affected-by-recent-disasters-by-banks/,"The Central Bank of Sri Lanka (CBSL), in view of the adverse effects of the recent cyclonic and flood disasters, having considered the proposals of the Sri Lanka Banks’ Association (Guarantee) Ltd. (SLBA) and the need to grant effective relief to those affected without unduly compromising financial system stability, issued the Circular No. 04 of [&#8230;]","Fri, 05 Dec 2025 20:15:44 +0000",6.92,relief measures assist businesses affected recent disasters banks central bank sri lanka cbsl view adverse effects recent cyclonic flood disasters considered proposals sri lanka banks association guarantee ltd slba need grant effective relief affected without unduly compromising financial system stability issued circular 04 8230,4,0.2263,3.5,3.7263,High Opportunity,"weather, transport, economic, sentiment",Emerging Event,"Sri, Lanka, Cyclone"
LankaBusinessOnline,IMF Considers USD 200 Mn Emergency Aid for Cyclone-Hit Sri Lanka,https://www.lankabusinessonline.com/imf-considers-usd-200-mn-emergency-aid-for-cyclone-hit-sri-lanka/,"International Monetary Fund (IMF) Mission Chief for Sri Lanka, Evan Papageorgiou, issued a statement today addressing the impact of Cyclone Ditwah and the resulting financial request from the Sri Lankan government. He began by extending the IMF's sympathies to the population profoundly affected by the natural disaster: ""In the wake of the devastating impact and [&#8230;]","Fri, 05 Dec 2025 16:30:52 +0000",6.92,imf considers usd 200 mn emergency aid cyclone hit sri lanka international monetary fund imf mission chief sri lanka evan papageorgiou issued statement today addressing impact cyclone ditwah resulting financial request sri lankan government began extending imf sympathies population profoundly affected natural disaster wake devastating impact 8230,4,-0.8779,-10.0,-10.0,High Risk,"weather, health, economic, sentiment",Emerging Event,"Sri, Lanka, Cyclone"
LankaBusinessOnline,IMF Exploring Options for Further Support to Sri Lanka’s Recovery After Cyclone Devastation,https://www.lankabusinessonline.com/imf-exploring-options-for-further-support-to-sri-lankas-recovery-after-cyclone-devastation/,"The International Monetary Fund (IMF) is actively investigating options to further support Sri Lanka in the recovery process following the devastating cyclone and widespread flooding. This commitment comes as the IMF continues to back Sri Lanka's reform efforts under the Extended Fund Facility (EFF) arrangement. The IMF's Director of Communications, Julie Kozack, conveyed the institution's [&#8230;]","Fri, 05 Dec 2025 06:44:15 +0000",6.92,imf exploring options support sri lanka recovery cyclone devastation international monetary fund imf actively investigating options support sri lanka recovery process following devastating cyclone widespread flooding commitment comes imf continues back sri lanka reform efforts extended fund facility eff arrangement imf director communications julie kozack conveyed institution 8230,4,0.296,-1.5,-1.204,Risk,"weather, transport, energy, economic",Emerging Event,"Sri, Lanka, Cyclone"
LankaBusinessOnline,Banks Association pledges strong support for economic revival,https://www.lankabusinessonline.com/banks-association-pledges-strong-support-for-economic-revival/,The Sri Lanka Banks Association (SLBA) in a meeting with the Governor of the Central Bank of Sri Lanka (CBSL) today pledged its fullest support to revive the country’s economy following the damage inflicted by Cyclone Ditwah.&#160; The banks represented by the Association stated that a detailed impact assessment has already been initiated across banks [&#8230;],"Wed, 03 Dec 2025 13:20:27 +0000",6.92,banks association pledges strong support economic revival sri lanka banks association slba meeting governor central bank sri lanka cbsl today pledged fullest support revive country economy following damage inflicted cyclone ditwah 160 banks represented association stated detailed impact assessment already initiated across banks 8230,4,0.7845,-3.5,-2.7155,High Risk,"weather, transport, economic",Emerging Event,"Sri, Lanka, Cyclone"
LankaBusinessOnline,Sri Lanka economic summit opened with focus on recovery and resilience after cyclone Ditwah,https://www.lankabusinessonline.com/sri-lanka-economic-summit-opened-with-focus-on-recovery-and-resilience-after-cyclone-ditwah/,"The Ceylon Chamber of Commerce opened the Sri Lanka Economic &#38; Investment Summit on Tuesday with a renewed sense of purpose, reframing the annual event as a platform for national recovery following the devastation caused by Cyclone Ditwah. Addressing more than 800 delegates, including over 100 overseas investors, the Chamber’s Chairperson, Krishan Balendra began by [&#8230;]","Wed, 03 Dec 2025 06:01:32 +0000",6.92,sri lanka economic summit opened focus recovery resilience cyclone ditwah ceylon chamber commerce opened sri lanka economic 38 investment summit tuesday renewed sense purpose reframing annual event platform national recovery following devastation caused cyclone ditwah addressing 800 delegates including 100 overseas investors chamber chairperson krishan balendra began 8230,4,-0.4215,-5.5,-5.9215,High Risk,"weather, transport, energy, economic",Emerging Event,"Sri, Lanka, Cyclone"
LankaBusinessOnline,Management committee of ‘Rebuilding Sri Lanka’ fund appointed with  reps from  public and pvt sectors,https://www.lankabusinessonline.com/management-committee-of-rebuilding-sri-lanka-fund-appointed-with-reps-from-public-and-pvt-sectors/,"Cabinet approval has been granted to establish the ‘Rebuilding Sri Lanka’ Fund, aimed at rebuilding the country following the severe devastation caused by Cyclone ‘Ditwah’, one of the worst natural disasters in Sri Lanka’s recent history. The Fund is to be established as a statutory fund under the Presidential Secretariat and its Management Committee will [&#8230;]","Tue, 02 Dec 2025 04:25:27 +0000",6.92,management committee rebuilding sri lanka fund appointed reps public pvt sectors cabinet approval granted establish rebuilding sri lanka fund aimed rebuilding country following severe devastation caused cyclone ditwah one worst natural disasters sri lanka recent history fund established statutory fund presidential secretariat management committee 8230,4,-0.7579,-3.0,-3.7579000000000002,High Risk,"weather, transport, energy, sentiment",Emerging Event,"Sri, Lanka, Cyclone"
Dinamina,27 වන ජනාධිපති අපනයන සම්මාන උළෙල හෙට,https://www.dinamina.lk/2025/12/10/local/246569/27-%e0%b7%80%e0%b6%b1-%e0%b6%a2%e0%b6%b1%e0%b7%8f%e0%b6%b0%e0%b7%92%e0%b6%b4%e0%b6%ad%e0%b7%92-%e0%b6%85%e0%b6%b4%e0%b6%b1%e0%b6%ba%e0%b6%b1-%e0%b7%83%e0%b6%b8%e0%b7%8a%e0%b6%b8%e0%b7%8f%e0%b6%b1/,"ශ්‍රී ලංකා අපනයන සංවර්ධන මණ්ඩලය (EDB) විසින් සංවිධානය කරනු ලබන 27 වැනි ජනාධිපති අපනයන සම්මාන (PEA) උළෙල ජනාධිපති අනුර කුමාර දිසානායක මහතාගේ&#8230;
The post 27 වන ජනාධිපති අපනයන සම්මාන උළෙල හෙට appeared first on දිනමිණ.","Wed, 10 Dec 2025 09:16:07 +0000",5.9,27 edb 27 pea 8230 post 27 appeared first,1,0.0,0.0,0.0,Neutral,general,Normal,"Post, Appeared, 8230"
Dinamina,ආපදා තත්ත්වයෙන් පසු ජල සැපයුම 99%ක් යථාතත්ත්වයට,https://www.dinamina.lk/2025/12/10/breaking-news/246567/%e0%b6%86%e0%b6%b4%e0%b6%af%e0%b7%8f-%e0%b6%ad%e0%b6%ad%e0%b7%8a%e0%b6%ad%e0%b7%8a%e0%b7%80%e0%b6%ba%e0%b7%99%e0%b6%b1%e0%b7%8a-%e0%b6%b4%e0%b7%83%e0%b7%94-%e0%b6%a2%e0%b6%bd-%e0%b7%83%e0%b7%90/,"ආපදාවට ලක් වූ ප්‍රදේශවල ජල සැපයුම 99% ක් මේ වන විට යථාවත් කර ඇති බව ජල සම්පාදන හා ජලාපවාහන මණ්ඩලයේ වැඩ බලන&#8230;
The post ආපදා තත්ත්වයෙන් පසු ජල සැපයුම 99%ක් යථාතත්ත්වයට appeared first on දිනමිණ.","Wed, 10 Dec 2025 09:13:13 +0000",5.9,99 99 8230 post 99 appeared first,1,0.0,0.0,0.0,Neutral,general,Normal,"Post, Appeared, 8230"
Dinamina,යළි ගොඩනැගෙන මව්බිමට සෙත් පතා සර්ව රාත්‍රීක පරිත්‍රාණ ධර්ම දේශනාවක්,https://www.dinamina.lk/2025/12/10/breaking-news/246564/%e0%b6%ba%e0%b7%85%e0%b7%92-%e0%b6%9c%e0%b7%9c%e0%b6%a9%e0%b6%b1%e0%b7%90%e0%b6%9c%e0%b7%99%e0%b6%b1-%e0%b6%b8%e0%b7%80%e0%b7%8a%e0%b6%b6%e0%b7%92%e0%b6%b8%e0%b6%a7-%e0%b7%83%e0%b7%99%e0%b6%ad/,"පසුගිය දා ඇතිවූ අපදා තත්ත්වය හේතුවෙන් විපතට පත් සියලු දෙනා සඳහා සෙත් ප්‍රාර්ථනා කිරීමේ අරමුණින් සංවිධාන කළ සර්ව රාත්‍රික පරිත්‍රාණ ධර්ම දේශනාව&#8230;
The post යළි ගොඩනැගෙන මව්බිමට සෙත් පතා සර්ව රාත්‍රීක පරිත්‍රාණ ධර්ම දේශනාවක් appeared first on දිනමිණ.","Wed, 10 Dec 2025 09:06:04 +0000",5.9,8230 post appeared first,1,0.0,0.0,0.0,Neutral,general,Normal,"Post, Appeared, 8230"
Dinamina,යුරෝපා සංගමයෙ​න් ශ්‍රී ලංකාවට යුරෝ මිලියන 1.8ක මානුෂීය ආධාරයක්,https://www.dinamina.lk/2025/12/10/local/246555/%e0%b6%ba%e0%b7%94%e0%b6%bb%e0%b7%9d%e0%b6%b4%e0%b7%8f-%e0%b7%83%e0%b6%82%e0%b6%9c%e0%b6%b8%e0%b6%ba%e0%b7%99%e0%b6%b1%e0%b7%8a-%e0%b7%81%e0%b7%8a%e0%b6%bb%e0%b7%93-%e0%b6%bd/,"මෑත දිනවල ඇති වූ විනාශකාරී නායයෑම් සහ ගංවතුරට ප්‍රතිචාර වශයෙන් යුරෝපා සංගමය විසින් ශ්‍රී ලංකාවට යුරෝ මිලියන 1.8ක හදිසි මානුෂීය ආධාර ප්‍රදානයක්&#8230;
The post යුරෝපා සංගමයෙ​න් ශ්‍රී ලංකාවට යුරෝ මිලියන 1.8ක මානුෂීය ආධාරයක් appeared first on දිනමිණ.","Wed, 10 Dec 2025 07:18:04 +0000",5.9,1 8 1 8 8230 post 1 8 appeared first,1,0.0,0.0,0.0,Neutral,general,Normal,"Post, Appeared, 8230"
Dinamina,රස පරීක්ෂක වාර්තා ලබාදීමේ තාක්ෂණික ක්‍රමවේදයක් ගැන සාකච්ඡාවක්,https://www.dinamina.lk/2025/12/10/lawnorder/246552/%e0%b6%bb%e0%b7%83-%e0%b6%b4%e0%b6%bb%e0%b7%93%e0%b6%9a%e0%b7%8a%e0%b7%82%e0%b6%9a-%e0%b7%80%e0%b7%8f%e0%b6%bb%e0%b7%8a%e0%b6%ad%e0%b7%8f-%e0%b6%bd%e0%b6%b6%e0%b7%8f%e0%b6%af%e0%b7%93%e0%b6%b8/,"රජයේ රස පරීක්ෂක දෙපාර්තමේන්තුවේ අවශ්‍යතා සොයා බැලීමේ විශේෂ සාකච්ඡාවක් අධිකරණ සහ ජාතික ඒකාබද්ධතා අමාත්‍ය, නීතිඥ හර්ෂණ නානායක්කාර මහතාගේ ප්‍රධානත්වයෙන් ඊයේ (09) පස්වරුවේ&#8230;
The post රස පරීක්ෂක වාර්තා ලබාදීමේ තාක්ෂණික ක්‍රමවේදයක් ගැන සාකච්ඡාවක් appeared first on දිනමිණ.","Wed, 10 Dec 2025 06:54:23 +0000",5.9,09 8230 post appeared first,1,0.0,0.0,0.0,Neutral,general,Normal,"Post, Appeared, 8230"
